{
  "$schema": "http://json-schema.org/draft-07/schema#",
  "$id": "https://ai-patterns.dev/schemas/category.schema.json",
  "title": "Category",
  "type": "object",
  "additionalProperties": false,
  "required": ["id", "num", "color", "name", "tagline", "blurb"],
  "properties": {
    "id":      { "type": "string", "minLength": 1, "pattern": "^[a-z][a-z0-9-]*$" },
    "num":     { "type": "string", "pattern": "^[0-9]{2}$" },
    "color":   { "type": "string", "minLength": 1, "description": "CSS color/variable used for accent." },
    "name":    { "type": "string", "minLength": 1 },
    "tagline": { "type": "string", "minLength": 1 },
    "blurb":   { "type": "string", "minLength": 1 }
  }
}
