{
  "id": "context",
  "num": "02",
  "color": "var(--cat-context)",
  "name": "Context Engineering",
  "tagline": "Provide the evidence each task needs, with retrieval and compaction fitted to the model and window.",
  "blurb": "Context is a task-specific interface to project evidence. Select, retrieve, structure or compact it when measured outcomes justify the cost and risk."
}
